{
  "approval_ref": null,
  "approval_status": "DRAFT",
  "camera_catalog_sha256": "aea8336b89bdc5eaa791ba7b8661093a5c4bd99f41668b349c90f4d71eee49a8",
  "cameras": [
    {
      "calibration_sha256": "aea8336b89bdc5eaa791ba7b8661093a5c4bd99f41668b349c90f4d71eee49a8",
      "camera_id": "SYNTHETIC_A",
      "covered_regions": [
        {
          "basis": "STATIC_VISIBILITY_INDEX",
          "region_id": "SYNTHETIC_R0",
          "visibility_ref": "SYNTHETIC_ONLY",
          "visible_area_m2": null
        }
      ],
      "entry_zones": [
        {
          "entry_zone_id": "SYNTHETIC_A:ENTRY",
          "roi_polygon_px": [
            [
              0,
              0
            ],
            [
              100,
              0
            ],
            [
              100,
              100
            ],
            [
              0,
              100
            ]
          ]
        }
      ],
      "exit_zones": [
        {
          "exit_zone_id": "SYNTHETIC_A:EXIT",
          "leads_to_edge_ids": [
            "SYNTHETIC_E01"
          ],
          "mapping_basis": "MANUAL_ON_STATIC_FRAME",
          "roi_polygon_px": [
            [
              0,
              0
            ],
            [
              100,
              0
            ],
            [
              100,
              100
            ],
            [
              0,
              100
            ]
          ],
          "static_frame_ref": "SYNTHETIC_ONLY",
          "static_frame_sha256": "aea8336b89bdc5eaa791ba7b8661093a5c4bd99f41668b349c90f4d71eee49a8"
        }
      ]
    },
    {
      "calibration_sha256": "aea8336b89bdc5eaa791ba7b8661093a5c4bd99f41668b349c90f4d71eee49a8",
      "camera_id": "SYNTHETIC_B",
      "covered_regions": [
        {
          "basis": "STATIC_VISIBILITY_INDEX",
          "region_id": "SYNTHETIC_R0",
          "visibility_ref": "SYNTHETIC_ONLY",
          "visible_area_m2": null
        }
      ],
      "entry_zones": [
        {
          "entry_zone_id": "SYNTHETIC_B:ENTRY",
          "roi_polygon_px": [
            [
              0,
              0
            ],
            [
              100,
              0
            ],
            [
              100,
              100
            ],
            [
              0,
              100
            ]
          ]
        }
      ],
      "exit_zones": [
        {
          "exit_zone_id": "SYNTHETIC_B:EXIT",
          "leads_to_edge_ids": [
            "SYNTHETIC_E01"
          ],
          "mapping_basis": "MANUAL_ON_STATIC_FRAME",
          "roi_polygon_px": [
            [
              0,
              0
            ],
            [
              100,
              0
            ],
            [
              100,
              100
            ],
            [
              0,
              100
            ]
          ],
          "static_frame_ref": "SYNTHETIC_ONLY",
          "static_frame_sha256": "aea8336b89bdc5eaa791ba7b8661093a5c4bd99f41668b349c90f4d71eee49a8"
        }
      ]
    },
    {
      "calibration_sha256": "aea8336b89bdc5eaa791ba7b8661093a5c4bd99f41668b349c90f4d71eee49a8",
      "camera_id": "SYNTHETIC_C",
      "covered_regions": [
        {
          "basis": "STATIC_VISIBILITY_INDEX",
          "region_id": "SYNTHETIC_R1",
          "visibility_ref": "SYNTHETIC_ONLY",
          "visible_area_m2": null
        }
      ],
      "entry_zones": [
        {
          "entry_zone_id": "SYNTHETIC_C:ENTRY",
          "roi_polygon_px": [
            [
              0,
              0
            ],
            [
              100,
              0
            ],
            [
              100,
              100
            ],
            [
              0,
              100
            ]
          ]
        }
      ],
      "exit_zones": [
        {
          "exit_zone_id": "SYNTHETIC_C:EXIT",
          "leads_to_edge_ids": [
            "SYNTHETIC_E01"
          ],
          "mapping_basis": "MANUAL_ON_STATIC_FRAME",
          "roi_polygon_px": [
            [
              0,
              0
            ],
            [
              100,
              0
            ],
            [
              100,
              100
            ],
            [
              0,
              100
            ]
          ],
          "static_frame_ref": "SYNTHETIC_ONLY",
          "static_frame_sha256": "aea8336b89bdc5eaa791ba7b8661093a5c4bd99f41668b349c90f4d71eee49a8"
        }
      ]
    }
  ],
  "content_sha256": "edec690154fef4ac03948b1b8bb7e63aca9861e90ca57081240b4766dae4a1f0",
  "graph_id": "cgraph:SYNTHETIC_R1:static:edec690154fef4ac",
  "inputs": [
    {
      "ref": "tracking-scope:SYNTHETIC:v3",
      "sha256": "81def088bfc90e4933cee8a85a17de61d6d4cdcab7500b69ee8bcc08ac4c3e34"
    }
  ],
  "region_graph_sha256": "ceb35bbeba1fac5b06f35f991a9bc222f8fc83a91ef2d91f808aac6fade7512b",
  "scene_id": "SYNTHETIC",
  "scene_revision": "SYNTHETIC_R1",
  "schema_version": "q-demo.camera-transition-graph.v1",
  "transitions": [
    {
      "basis_refs": [
        "SYNTHETIC_ONLY"
      ],
      "edge_path": [],
      "from_camera_id": "SYNTHETIC_A",
      "nominal_path_length_m": null,
      "path_has_unknown_state": false,
      "path_traversability": "APPROVED_WALKABLE",
      "ranking_area_m2": null,
      "ranking_area_refs": [],
      "region_hops": 0,
      "region_path": [
        "SYNTHETIC_R0"
      ],
      "relation": "UNKNOWN",
      "to_camera_id": "SYNTHETIC_B",
      "to_entry_zone_ids": [
        "SYNTHETIC_B:ENTRY"
      ],
      "transition_id": "T_SYNTHETIC_A__SYNTHETIC_B",
      "via_exit_zone_ids": [
        "SYNTHETIC_A:EXIT"
      ]
    },
    {
      "basis_refs": [
        "SYNTHETIC_ONLY"
      ],
      "edge_path": [
        "SYNTHETIC_E01"
      ],
      "from_camera_id": "SYNTHETIC_A",
      "nominal_path_length_m": null,
      "path_has_unknown_state": true,
      "path_traversability": "TOPOLOGICAL_ONLY",
      "ranking_area_m2": null,
      "ranking_area_refs": [],
      "region_hops": 1,
      "region_path": [
        "SYNTHETIC_R0",
        "SYNTHETIC_R1"
      ],
      "relation": "UNKNOWN",
      "to_camera_id": "SYNTHETIC_C",
      "to_entry_zone_ids": [
        "SYNTHETIC_C:ENTRY"
      ],
      "transition_id": "T_SYNTHETIC_A__SYNTHETIC_C",
      "via_exit_zone_ids": [
        "SYNTHETIC_A:EXIT"
      ]
    }
  ]
}
